hari,tanggal,time WITA,sport,competition,title,home,away,channel_1,channel_2,channel_3,channel_4,channel_5,channel_6,channel_7,channel_8,event_url
"Kamis","23-07-2026","02:30","","The Hundred 2026","Southern Brave vs Welsh Fire","Southern Brave","Welsh Fire","Southern Brave v Welsh Fire Broadcasted on Sky Sports Cricket","Southern Brave v Welsh Fire Broadcasted on Sky Sports Main Event","Southern Brave v Welsh Fire Broadcasted on Sky Sports Mix","Southern Brave v Welsh Fire Broadcasted on Sky Sports Ultra HDR","Southern Brave v Welsh Fire Broadcasted on BBC2","Southern Brave v Welsh Fire Broadcasted on BBC iPlayer","Southern Brave v Welsh Fire Broadcasted on BBC Sport Website","",""
"Kamis","23-07-2026","02:35","","MLB","New York Yankees vs Pittsburgh Pirates","New York Yankees","Pittsburgh Pirates","New York Yankees v Pittsburgh Pirates Broadcasted on TNT Sports 1","New York Yankees v Pittsburgh Pirates Broadcasted on HBO Max","","","","","","",""
"Kamis","23-07-2026","03:0","","","World Matchplay","World Matchplay","","World Matchplay Broadcasted on Sky Sports Action","World Matchplay Broadcasted on Sky Sports Main Event","World Matchplay Broadcasted on Sky Sports Ultra HDR","World Matchplay Broadcasted on Sky Sports+","","","","",""
"Kamis","23-07-2026","03:30","","Pre-season Friendly","Burton Albion vs Birmingham City","Burton Albion","Birmingham City","Burton Albion v Birmingham City Broadcasted on Blues+","","","","","","","",""
"Kamis","23-07-2026","03:45","","","Queen of the South vs Aberdeen","Queen of the South","Aberdeen","Queen of the South v Aberdeen Broadcasted on Premier Sports 1","","","","","","","",""
"Kamis","23-07-2026","04:40","","MLB","Seattle Mariners vs Cincinnati Reds","Seattle Mariners","Cincinnati Reds","Seattle Mariners v Cincinnati Reds Broadcasted on TNT Sports 1","Seattle Mariners v Cincinnati Reds Broadcasted on TNT Sports 2","Seattle Mariners v Cincinnati Reds Broadcasted on HBO Max","","","","","",""
"Kamis","23-07-2026","08:30","","MLS","FC Cincinnati vs Vancouver","FC Cincinnati","Vancouver","FC Cincinnati v Vancouver Broadcasted on Apple TV","","","","","","","",""
"Kamis","23-07-2026","08:30","","MLS","Columbus Crew vs New York City FC","Columbus Crew","New York City FC","Columbus Crew v New York City FC Broadcasted on Apple TV","","","","","","","",""
"Kamis","23-07-2026","08:30","","MLS","Inter Miami CF vs Chicago Fire","Inter Miami CF","Chicago Fire","Inter Miami CF v Chicago Fire Broadcasted on Apple TV","","","","","","","",""
"Kamis","23-07-2026","08:30","","MLS","New England Revolution vs Toronto FC","New England Revolution","Toronto FC","New England Revolution v Toronto FC Broadcasted on Apple TV","","","","","","","",""
"Kamis","23-07-2026","08:30","","MLS","Philadelphia Union vs New York Red Bulls","Philadelphia Union","New York Red Bulls","Philadelphia Union v New York Red Bulls Broadcasted on Apple TV","","","","","","","",""
"Kamis","23-07-2026","08:30","","","Indiana Fever vs Connecticut Sun","Indiana Fever","Connecticut Sun","Indiana Fever v Connecticut Sun Broadcasted on Sky Sports Action","Indiana Fever v Connecticut Sun Broadcasted on Sky Sports Main Event","Indiana Fever v Connecticut Sun Broadcasted on Sky Sports Ultra HDR","","","","","",""
"Kamis","23-07-2026","09:10","","MLB","Chicago Cubs vs Detroit Tigers","Chicago Cubs","Detroit Tigers","Chicago Cubs v Detroit Tigers Broadcasted on TNT Sports 1","Chicago Cubs v Detroit Tigers Broadcasted on HBO Max","","","","","","",""
"Kamis","23-07-2026","09:15","","MLS","Charlotte FC vs Atlanta United","Charlotte FC","Atlanta United","Charlotte FC v Atlanta United Broadcasted on Apple TV","","","","","","","",""
"Kamis","23-07-2026","09:30","","MLS","Austin FC vs Seattle Sounders FC","Austin FC","Seattle Sounders FC","Austin FC v Seattle Sounders FC Broadcasted on Apple TV","","","","","","","",""
"Kamis","23-07-2026","09:30","","MLS","Houston Dynamo vs DC United","Houston Dynamo","DC United","Houston Dynamo v DC United Broadcasted on Apple TV","","","","","","","",""
"Kamis","23-07-2026","09:30","","MLS","Nashville SC vs CF Montreal","Nashville SC","CF Montreal","Nashville SC v CF Montreal Broadcasted on Apple TV","","","","","","","",""
"Kamis","23-07-2026","09:30","","MLS","Sporting Kansas City vs Minnesota United","Sporting Kansas City","Minnesota United","Sporting Kansas City v Minnesota United Broadcasted on Apple TV","","","","","","","",""
"Kamis","23-07-2026","09:30","","Brasileiro Série A","Internacional vs Cruzeiro","Internacional","Cruzeiro","Internacional v Cruzeiro Broadcasted on Premier Sports 2","","","","","","","",""
"Kamis","23-07-2026","10:30","","MLS","Colorado Rapids vs San Diego FC","Colorado Rapids","San Diego FC","Colorado Rapids v San Diego FC Broadcasted on Apple TV","","","","","","","",""
"Kamis","23-07-2026","11:0","","","Portland Fire vs Dallas Wings","Portland Fire","Dallas Wings","Portland Fire v Dallas Wings Broadcasted on Sky Sports Action","Portland Fire v Dallas Wings Broadcasted on Sky Sports Main Event","Portland Fire v Dallas Wings Broadcasted on Sky Sports Ultra HDR","","","","","",""
"Kamis","23-07-2026","11:30","","MLS","LA Galaxy vs St Louis City SC","LA Galaxy","St Louis City SC","LA Galaxy v St Louis City SC Broadcasted on Apple TV","","","","","","","",""
"Kamis","23-07-2026","11:30","","MLS","Los Angeles FC vs Real Salt Lake","Los Angeles FC","Real Salt Lake","Los Angeles FC v Real Salt Lake Broadcasted on Apple TV","","","","","","","",""
"Kamis","23-07-2026","11:30","","MLS","Portland Timbers vs FC Dallas","Portland Timbers","FC Dallas","Portland Timbers v FC Dallas Broadcasted on Apple TV","","","","","","","",""
"Kamis","23-07-2026","11:30","","MLS","San Jose Earthquakes vs Orlando City SC","San Jose Earthquakes","Orlando City SC","San Jose Earthquakes v Orlando City SC Broadcasted on Apple TV","","","","","","","",""
"Kamis","23-07-2026","17:30","","","Womens Scottish Open","Womens Scottish Open","","Womens Scottish Open Broadcasted on Sky Sports Golf","Womens Scottish Open Broadcasted on Sky Sports Main Event","Womens Scottish Open Broadcasted on Sky Sports Ultra HDR","","","","","",""
"Kamis","23-07-2026","18:0","","One Day International","Nepal vs Netherlands","Nepal","Netherlands","Nepal v Netherlands Broadcasted on ICC TV","","","","","","","",""
"Kamis","23-07-2026","18:0","","","British Open","British Open","","British Open Broadcasted on WST Play","","","","","","","",""
"Kamis","23-07-2026","18:0","","","ATP Tennis","ATP Tennis","","ATP Tennis Broadcasted on Sky Sports Tennis","ATP Tennis Broadcasted on Sky Sports+","","","","","","",""
"Kamis","23-07-2026","18:30","","AFL","Adelaide Crows vs Collingwood","Adelaide Crows","Collingwood","Adelaide Crows v Collingwood Broadcasted on TNT Sports 3","Adelaide Crows v Collingwood Broadcasted on Watch AFL","Adelaide Crows v Collingwood Broadcasted on HBO Max","","","","","",""
"Kamis","23-07-2026","18:50","","NRL","Parramatta Eels vs Penrith Panthers","Parramatta Eels","Penrith Panthers","Parramatta Eels v Penrith Panthers Broadcasted on Watch NRL","","","","","","","",""
"Kamis","23-07-2026","19:35","","","UCI Tour de France","UCI Tour de France","","UCI Tour de France Broadcasted on TNT Sports 1","UCI Tour de France Broadcasted on BBC iPlayer","UCI Tour de France Broadcasted on HBO Max","UCI Tour de France Broadcasted on S4C","UCI Tour de France Broadcasted on S4C Clic","","","",""
"Kamis","23-07-2026","20:45","","","3M Open","3M Open","","3M Open Broadcasted on Sky Sports+","","","","","","","",""
"Kamis","23-07-2026","21:0","","","Raceday Live","Raceday Live","","Raceday Live Broadcasted on Sky Sports Racing","","","","","","","",""
"Kamis","23-07-2026","21:15","","","LIV Golf UK","LIV Golf UK","","LIV Golf UK Broadcasted on TNT Sports 2","LIV Golf UK Broadcasted on HBO Max","","","","","","",""
"Kamis","23-07-2026","21:30","","","Senior Open Championship","Senior Open Championship","","Senior Open Championship Broadcasted on Sky Sports Golf","","","","","","","",""
"Kamis","23-07-2026","21:45","","","Live Racing","Live Racing","","Live Racing Broadcasted on RacingTV","","","","","","","",""
"Kamis","23-07-2026","22:30","","","British Open","British Open","","British Open Broadcasted on WST Play","","","","","","","",""
"Kamis","23-07-2026","23:0","","The Hundred 2026","London Spirit Women vs Manchester Super Giants Women","London Spirit Women","Manchester Super Giants Women","London Spirit Women v Manchester Super Giants Women Broadcasted on Sky Sports Cricket","London Spirit Women v Manchester Super Giants Women Broadcasted on Sky Sports Main Event","London Spirit Women v Manchester Super Giants Women Broadcasted on Sky Sports Ultra HDR","","","","","",""
"Jumat","24-07-2026","01:0","","","Womens Scottish Open","Womens Scottish Open","","Womens Scottish Open Broadcasted on Sky Sports Mix","","","","","","","",""
"Jumat","24-07-2026","01:15","","MLB","Atlanta Braves vs San Diego Padres","Atlanta Braves","San Diego Padres","Atlanta Braves v San Diego Padres Broadcasted on TNT Sports 1","Atlanta Braves v San Diego Padres Broadcasted on TNT Sports 3","Atlanta Braves v San Diego Padres Broadcasted on HBO Max","","","","","",""
"Jumat","24-07-2026","02:30","","The Hundred 2026","London Spirit vs Manchester Super Giants","London Spirit","Manchester Super Giants","London Spirit v Manchester Super Giants Broadcasted on Sky Sports Cricket","London Spirit v Manchester Super Giants Broadcasted on Sky Sports Main Event","London Spirit v Manchester Super Giants Broadcasted on Sky Sports Ultra HDR","","","","","",""
"Jumat","24-07-2026","03:0","","","British Open","British Open","","British Open Broadcasted on WST Play","","","","","","","",""
"Jumat","24-07-2026","03:0","","","3M Open","3M Open","","3M Open Broadcasted on Sky Sports Golf","","","","","","","",""
"Jumat","24-07-2026","04:0","","","World Matchplay","World Matchplay","","World Matchplay Broadcasted on Sky Sports Action","World Matchplay Broadcasted on Sky Sports Main Event","World Matchplay Broadcasted on Sky Sports Ultra HDR","","","","","",""
"Jumat","24-07-2026","04:0","","Super League","Hull FC vs Hull KR","Hull FC","Hull KR","Hull FC v Hull KR Broadcasted on Sky Sports+","","","","","","","",""
"Jumat","24-07-2026","04:7","","MLB","Toronto Blue Jays vs Tampa Bay Rays","Toronto Blue Jays","Tampa Bay Rays","Toronto Blue Jays v Tampa Bay Rays Broadcasted on TNT Sports 1","Toronto Blue Jays v Tampa Bay Rays Broadcasted on HBO Max","","","","","","",""
